{
  "agent": "helper-reviewer",
  "path": "/Users/fadymondy/Sites/agents-team/plugins/agents-team/lib/eval/calibration/c-reviewer.md",
  "kind": "agent",
  "overall": {
    "score": 86,
    "grade": "B",
    "verdict": "reject"
  },
  "dimensions": {
    "frontmatter": {
      "score": 100,
      "weight": 0.15,
      "findings": []
    },
    "description": {
      "score": 70,
      "weight": 0.25,
      "findings": [
        {
          "severity": "warning",
          "rule": "description.length_outside_band",
          "message": "Agent description length 70 chars is outside the 80–400 band. Too short → ambiguous routing; too long → wastes routing context.",
          "produced_by": "static",
          "evidence": {
            "frontmatter_field": "description",
            "file": "/Users/fadymondy/Sites/agents-team/plugins/agents-team/lib/eval/calibration/c-reviewer.md",
            "line": 3,
            "value": "Reviews and audits code for quality, security, and performance issues."
          },
          "fix": "Aim for one or two sentences with both WHAT and WHEN.",
          "source": "https://code.claude.com/docs/en/sub-agents"
        },
        {
          "severity": "warning",
          "rule": "description.no_use_when_trigger",
          "message": "Description does not contain a \"use when\" / \"use proactively\" / \"MUST BE USED\" trigger phrase, so the orchestrator may under-delegate.",
          "produced_by": "static",
          "evidence": {
            "frontmatter_field": "description",
            "file": "/Users/fadymondy/Sites/agents-team/plugins/agents-team/lib/eval/calibration/c-reviewer.md",
            "line": 3
          },
          "fix": "Add e.g. \"Use immediately after writing or modifying code.\"",
          "source": "https://code.claude.com/docs/en/sub-agents"
        }
      ]
    },
    "tool_hygiene": {
      "score": 60,
      "weight": 0.15,
      "findings": [
        {
          "severity": "critical",
          "rule": "tool_hygiene.write_on_review_role",
          "message": "Description / body indicates a review or audit role, but `tools` includes write tools: ['Edit'].",
          "produced_by": "static",
          "evidence": {
            "frontmatter_field": "tools",
            "file": "/Users/fadymondy/Sites/agents-team/plugins/agents-team/lib/eval/calibration/c-reviewer.md",
            "line": 5,
            "value": [
              "Read",
              "Edit",
              "Bash"
            ]
          },
          "fix": "Remove write tools; reviewers should be read-only.",
          "source": "https://code.claude.com/docs/en/sub-agents"
        }
      ]
    },
    "model_fit": {
      "score": 100,
      "weight": 0.1,
      "findings": []
    },
    "body_structure": {
      "score": 95,
      "weight": 0.2,
      "findings": [
        {
          "severity": "suggestion",
          "rule": "body_structure.no_constraints_section",
          "message": "Body has no constraints / guardrails / anti-patterns section.",
          "produced_by": "static",
          "evidence": {
            "file": "/Users/fadymondy/Sites/agents-team/plugins/agents-team/lib/eval/calibration/c-reviewer.md",
            "line": 10
          },
          "fix": "Add a \"## Constraints\" section listing what the agent must NOT do.",
          "source": "https://code.claude.com/docs/en/sub-agents"
        }
      ]
    },
    "anti_patterns": {
      "score": 100,
      "weight": 0.15,
      "findings": []
    }
  },
  "findings": [
    {
      "severity": "critical",
      "rule": "tool_hygiene.write_on_review_role",
      "message": "Description / body indicates a review or audit role, but `tools` includes write tools: ['Edit'].",
      "produced_by": "static",
      "evidence": {
        "frontmatter_field": "tools",
        "file": "/Users/fadymondy/Sites/agents-team/plugins/agents-team/lib/eval/calibration/c-reviewer.md",
        "line": 5,
        "value": [
          "Read",
          "Edit",
          "Bash"
        ]
      },
      "fix": "Remove write tools; reviewers should be read-only.",
      "source": "https://code.claude.com/docs/en/sub-agents"
    },
    {
      "severity": "warning",
      "rule": "description.length_outside_band",
      "message": "Agent description length 70 chars is outside the 80–400 band. Too short → ambiguous routing; too long → wastes routing context.",
      "produced_by": "static",
      "evidence": {
        "frontmatter_field": "description",
        "file": "/Users/fadymondy/Sites/agents-team/plugins/agents-team/lib/eval/calibration/c-reviewer.md",
        "line": 3,
        "value": "Reviews and audits code for quality, security, and performance issues."
      },
      "fix": "Aim for one or two sentences with both WHAT and WHEN.",
      "source": "https://code.claude.com/docs/en/sub-agents"
    },
    {
      "severity": "warning",
      "rule": "description.no_use_when_trigger",
      "message": "Description does not contain a \"use when\" / \"use proactively\" / \"MUST BE USED\" trigger phrase, so the orchestrator may under-delegate.",
      "produced_by": "static",
      "evidence": {
        "frontmatter_field": "description",
        "file": "/Users/fadymondy/Sites/agents-team/plugins/agents-team/lib/eval/calibration/c-reviewer.md",
        "line": 3
      },
      "fix": "Add e.g. \"Use immediately after writing or modifying code.\"",
      "source": "https://code.claude.com/docs/en/sub-agents"
    },
    {
      "severity": "suggestion",
      "rule": "body_structure.no_constraints_section",
      "message": "Body has no constraints / guardrails / anti-patterns section.",
      "produced_by": "static",
      "evidence": {
        "file": "/Users/fadymondy/Sites/agents-team/plugins/agents-team/lib/eval/calibration/c-reviewer.md",
        "line": 10
      },
      "fix": "Add a \"## Constraints\" section listing what the agent must NOT do.",
      "source": "https://code.claude.com/docs/en/sub-agents"
    }
  ],
  "produced_by": "static",
  "produced_at": "2026-04-29T12:02:03Z",
  "schema_version": "1.0.0"
}
