{
  "agent": "do-everything",
  "path": "/Users/fadymondy/Sites/agents-team/plugins/agents-team/lib/eval/calibration/f-bare.md",
  "kind": "agent",
  "overall": {
    "score": 82,
    "grade": "B",
    "verdict": "reject"
  },
  "dimensions": {
    "frontmatter": {
      "score": 60,
      "weight": 0.15,
      "findings": [
        {
          "severity": "critical",
          "rule": "frontmatter.description_missing",
          "message": "`description` is required in frontmatter.",
          "produced_by": "static",
          "evidence": {
            "frontmatter_field": "description"
          },
          "fix": "Add a description that says WHEN to use this and WHAT it does (third person).",
          "source": "https://code.claude.com/docs/en/sub-agents"
        }
      ]
    },
    "description": {
      "score": 100,
      "weight": 0.25,
      "findings": []
    },
    "tool_hygiene": {
      "score": 60,
      "weight": 0.15,
      "findings": [
        {
          "severity": "critical",
          "rule": "tool_hygiene.tools_omitted",
          "message": "`tools` is not set \u2014 the agent silently inherits every tool from the parent (the most common over-grant anti-pattern).",
          "produced_by": "static",
          "evidence": {
            "frontmatter_field": "tools"
          },
          "fix": "Add an explicit `tools:` list, even if it is the full set you actually need.",
          "source": "https://code.claude.com/docs/en/sub-agents"
        }
      ]
    },
    "model_fit": {
      "score": 100,
      "weight": 0.1,
      "findings": []
    },
    "body_structure": {
      "score": 90,
      "weight": 0.2,
      "findings": [
        {
          "severity": "suggestion",
          "rule": "body_structure.no_when_invoked_section",
          "message": "Body has no \"When invoked\" / procedure / workflow heading.",
          "produced_by": "static",
          "evidence": {
            "file": "/Users/fadymondy/Sites/agents-team/plugins/agents-team/lib/eval/calibration/f-bare.md",
            "line": 4
          },
          "fix": "Add a numbered \"## When invoked\" section listing the agent's procedure.",
          "source": "https://code.claude.com/docs/en/sub-agents"
        },
        {
          "severity": "suggestion",
          "rule": "body_structure.no_constraints_section",
          "message": "Body has no constraints / guardrails / anti-patterns section.",
          "produced_by": "static",
          "evidence": {
            "file": "/Users/fadymondy/Sites/agents-team/plugins/agents-team/lib/eval/calibration/f-bare.md",
            "line": 4
          },
          "fix": "Add a \"## Constraints\" section listing what the agent must NOT do.",
          "source": "https://code.claude.com/docs/en/sub-agents"
        }
      ]
    },
    "anti_patterns": {
      "score": 70,
      "weight": 0.15,
      "findings": [
        {
          "severity": "warning",
          "rule": "anti_patterns.injection_ignore_prior",
          "message": "\"ignore prior/all/previous instructions\" is a classic injection phrase.",
          "produced_by": "static",
          "evidence": {
            "file": "/Users/fadymondy/Sites/agents-team/plugins/agents-team/lib/eval/calibration/f-bare.md",
            "line": 7,
            "match": "ignore previous instructions"
          },
          "fix": "Remove or rephrase. Constraints belong in the `## Constraints` section, not as override directives.",
          "source": "https://code.claude.com/docs/en/sub-agents"
        },
        {
          "severity": "warning",
          "rule": "anti_patterns.injection_respond_only",
          "message": "\"respond only with\u2026\" overrides the user \u2014 review carefully.",
          "produced_by": "static",
          "evidence": {
            "file": "/Users/fadymondy/Sites/agents-team/plugins/agents-team/lib/eval/calibration/f-bare.md",
            "line": 7,
            "match": "respond only with"
          },
          "fix": "Remove or rephrase. Constraints belong in the `## Constraints` section, not as override directives.",
          "source": "https://code.claude.com/docs/en/sub-agents"
        }
      ]
    }
  },
  "findings": [
    {
      "severity": "critical",
      "rule": "frontmatter.description_missing",
      "message": "`description` is required in frontmatter.",
      "produced_by": "static",
      "evidence": {
        "frontmatter_field": "description"
      },
      "fix": "Add a description that says WHEN to use this and WHAT it does (third person).",
      "source": "https://code.claude.com/docs/en/sub-agents"
    },
    {
      "severity": "critical",
      "rule": "tool_hygiene.tools_omitted",
      "message": "`tools` is not set \u2014 the agent silently inherits every tool from the parent (the most common over-grant anti-pattern).",
      "produced_by": "static",
      "evidence": {
        "frontmatter_field": "tools"
      },
      "fix": "Add an explicit `tools:` list, even if it is the full set you actually need.",
      "source": "https://code.claude.com/docs/en/sub-agents"
    },
    {
      "severity": "warning",
      "rule": "anti_patterns.injection_ignore_prior",
      "message": "\"ignore prior/all/previous instructions\" is a classic injection phrase.",
      "produced_by": "static",
      "evidence": {
        "file": "/Users/fadymondy/Sites/agents-team/plugins/agents-team/lib/eval/calibration/f-bare.md",
        "line": 7,
        "match": "ignore previous instructions"
      },
      "fix": "Remove or rephrase. Constraints belong in the `## Constraints` section, not as override directives.",
      "source": "https://code.claude.com/docs/en/sub-agents"
    },
    {
      "severity": "warning",
      "rule": "anti_patterns.injection_respond_only",
      "message": "\"respond only with\u2026\" overrides the user \u2014 review carefully.",
      "produced_by": "static",
      "evidence": {
        "file": "/Users/fadymondy/Sites/agents-team/plugins/agents-team/lib/eval/calibration/f-bare.md",
        "line": 7,
        "match": "respond only with"
      },
      "fix": "Remove or rephrase. Constraints belong in the `## Constraints` section, not as override directives.",
      "source": "https://code.claude.com/docs/en/sub-agents"
    },
    {
      "severity": "suggestion",
      "rule": "body_structure.no_when_invoked_section",
      "message": "Body has no \"When invoked\" / procedure / workflow heading.",
      "produced_by": "static",
      "evidence": {
        "file": "/Users/fadymondy/Sites/agents-team/plugins/agents-team/lib/eval/calibration/f-bare.md",
        "line": 4
      },
      "fix": "Add a numbered \"## When invoked\" section listing the agent's procedure.",
      "source": "https://code.claude.com/docs/en/sub-agents"
    },
    {
      "severity": "suggestion",
      "rule": "body_structure.no_constraints_section",
      "message": "Body has no constraints / guardrails / anti-patterns section.",
      "produced_by": "static",
      "evidence": {
        "file": "/Users/fadymondy/Sites/agents-team/plugins/agents-team/lib/eval/calibration/f-bare.md",
        "line": 4
      },
      "fix": "Add a \"## Constraints\" section listing what the agent must NOT do.",
      "source": "https://code.claude.com/docs/en/sub-agents"
    }
  ],
  "produced_by": "static",
  "produced_at": "2026-04-29T12:02:03Z",
  "schema_version": "1.0.0"
}
