{
  "agent": "code-auditor",
  "path": "/Users/fadymondy/Sites/agents-team/plugins/agents-team/lib/eval/calibration/d-reviewer-with-edit.md",
  "kind": "agent",
  "overall": {
    "score": 92,
    "grade": "A",
    "verdict": "reject"
  },
  "dimensions": {
    "frontmatter": {
      "score": 100,
      "weight": 0.15,
      "findings": []
    },
    "description": {
      "score": 100,
      "weight": 0.25,
      "findings": []
    },
    "tool_hygiene": {
      "score": 60,
      "weight": 0.15,
      "findings": [
        {
          "severity": "critical",
          "rule": "tool_hygiene.write_on_review_role",
          "message": "Description / body indicates a review or audit role, but `tools` includes write tools: ['Edit'].",
          "produced_by": "static",
          "evidence": {
            "frontmatter_field": "tools",
            "file": "/Users/fadymondy/Sites/agents-team/plugins/agents-team/lib/eval/calibration/d-reviewer-with-edit.md",
            "line": 5,
            "value": [
              "Read",
              "Edit",
              "Bash"
            ]
          },
          "fix": "Remove write tools; reviewers should be read-only.",
          "source": "https://code.claude.com/docs/en/sub-agents"
        }
      ]
    },
    "model_fit": {
      "score": 100,
      "weight": 0.1,
      "findings": []
    },
    "body_structure": {
      "score": 90,
      "weight": 0.2,
      "findings": [
        {
          "severity": "suggestion",
          "rule": "body_structure.no_when_invoked_section",
          "message": "Body has no \"When invoked\" / procedure / workflow heading.",
          "produced_by": "static",
          "evidence": {
            "file": "/Users/fadymondy/Sites/agents-team/plugins/agents-team/lib/eval/calibration/d-reviewer-with-edit.md",
            "line": 10
          },
          "fix": "Add a numbered \"## When invoked\" section listing the agent's procedure.",
          "source": "https://code.claude.com/docs/en/sub-agents"
        },
        {
          "severity": "suggestion",
          "rule": "body_structure.no_constraints_section",
          "message": "Body has no constraints / guardrails / anti-patterns section.",
          "produced_by": "static",
          "evidence": {
            "file": "/Users/fadymondy/Sites/agents-team/plugins/agents-team/lib/eval/calibration/d-reviewer-with-edit.md",
            "line": 10
          },
          "fix": "Add a \"## Constraints\" section listing what the agent must NOT do.",
          "source": "https://code.claude.com/docs/en/sub-agents"
        }
      ]
    },
    "anti_patterns": {
      "score": 100,
      "weight": 0.15,
      "findings": []
    }
  },
  "findings": [
    {
      "severity": "critical",
      "rule": "tool_hygiene.write_on_review_role",
      "message": "Description / body indicates a review or audit role, but `tools` includes write tools: ['Edit'].",
      "produced_by": "static",
      "evidence": {
        "frontmatter_field": "tools",
        "file": "/Users/fadymondy/Sites/agents-team/plugins/agents-team/lib/eval/calibration/d-reviewer-with-edit.md",
        "line": 5,
        "value": [
          "Read",
          "Edit",
          "Bash"
        ]
      },
      "fix": "Remove write tools; reviewers should be read-only.",
      "source": "https://code.claude.com/docs/en/sub-agents"
    },
    {
      "severity": "suggestion",
      "rule": "body_structure.no_when_invoked_section",
      "message": "Body has no \"When invoked\" / procedure / workflow heading.",
      "produced_by": "static",
      "evidence": {
        "file": "/Users/fadymondy/Sites/agents-team/plugins/agents-team/lib/eval/calibration/d-reviewer-with-edit.md",
        "line": 10
      },
      "fix": "Add a numbered \"## When invoked\" section listing the agent's procedure.",
      "source": "https://code.claude.com/docs/en/sub-agents"
    },
    {
      "severity": "suggestion",
      "rule": "body_structure.no_constraints_section",
      "message": "Body has no constraints / guardrails / anti-patterns section.",
      "produced_by": "static",
      "evidence": {
        "file": "/Users/fadymondy/Sites/agents-team/plugins/agents-team/lib/eval/calibration/d-reviewer-with-edit.md",
        "line": 10
      },
      "fix": "Add a \"## Constraints\" section listing what the agent must NOT do.",
      "source": "https://code.claude.com/docs/en/sub-agents"
    }
  ],
  "produced_by": "static",
  "produced_at": "2026-04-29T12:02:03Z",
  "schema_version": "1.0.0"
}
