{
  "agent": "vague-helper",
  "path": "/Users/fadymondy/Sites/agents-team/plugins/agents-team/lib/eval/calibration/c-vague.md",
  "kind": "agent",
  "overall": {
    "score": 96,
    "grade": "A",
    "verdict": "ship"
  },
  "dimensions": {
    "frontmatter": {
      "score": 100,
      "weight": 0.15,
      "findings": []
    },
    "description": {
      "score": 95,
      "weight": 0.25,
      "findings": [
        {
          "severity": "suggestion",
          "rule": "description.no_use_when_trigger",
          "message": "Description does not contain a \"use when\" / \"use proactively\" / \"MUST BE USED\" trigger phrase, so the orchestrator may under-delegate.",
          "produced_by": "static",
          "evidence": {
            "frontmatter_field": "description",
            "file": "/Users/fadymondy/Sites/agents-team/plugins/agents-team/lib/eval/calibration/c-vague.md",
            "line": 3
          },
          "fix": "Add e.g. \"Use immediately after writing or modifying code.\"",
          "source": "https://code.claude.com/docs/en/sub-agents"
        }
      ]
    },
    "tool_hygiene": {
      "score": 100,
      "weight": 0.15,
      "findings": []
    },
    "model_fit": {
      "score": 85,
      "weight": 0.1,
      "findings": [
        {
          "severity": "warning",
          "rule": "model_fit.opus_on_readonly_role",
          "message": "Role appears read-only / triage but uses Opus. Anthropic guidance: read-only/lookup roles \u2192 Haiku; Sonnet for code; Opus for hard reasoning.",
          "produced_by": "static",
          "evidence": {
            "frontmatter_field": "model",
            "file": "/Users/fadymondy/Sites/agents-team/plugins/agents-team/lib/eval/calibration/c-vague.md",
            "line": 4,
            "value": "opus"
          },
          "fix": "Switch to Haiku (cheap, fast) unless the role does multi-step reasoning.",
          "source": "https://code.claude.com/docs/en/sub-agents"
        }
      ]
    },
    "body_structure": {
      "score": 95,
      "weight": 0.2,
      "findings": [
        {
          "severity": "suggestion",
          "rule": "body_structure.no_constraints_section",
          "message": "Body has no constraints / guardrails / anti-patterns section.",
          "produced_by": "static",
          "evidence": {
            "file": "/Users/fadymondy/Sites/agents-team/plugins/agents-team/lib/eval/calibration/c-vague.md",
            "line": 11
          },
          "fix": "Add a \"## Constraints\" section listing what the agent must NOT do.",
          "source": "https://code.claude.com/docs/en/sub-agents"
        }
      ]
    },
    "anti_patterns": {
      "score": 100,
      "weight": 0.15,
      "findings": []
    }
  },
  "findings": [
    {
      "severity": "warning",
      "rule": "model_fit.opus_on_readonly_role",
      "message": "Role appears read-only / triage but uses Opus. Anthropic guidance: read-only/lookup roles \u2192 Haiku; Sonnet for code; Opus for hard reasoning.",
      "produced_by": "static",
      "evidence": {
        "frontmatter_field": "model",
        "file": "/Users/fadymondy/Sites/agents-team/plugins/agents-team/lib/eval/calibration/c-vague.md",
        "line": 4,
        "value": "opus"
      },
      "fix": "Switch to Haiku (cheap, fast) unless the role does multi-step reasoning.",
      "source": "https://code.claude.com/docs/en/sub-agents"
    },
    {
      "severity": "suggestion",
      "rule": "description.no_use_when_trigger",
      "message": "Description does not contain a \"use when\" / \"use proactively\" / \"MUST BE USED\" trigger phrase, so the orchestrator may under-delegate.",
      "produced_by": "static",
      "evidence": {
        "frontmatter_field": "description",
        "file": "/Users/fadymondy/Sites/agents-team/plugins/agents-team/lib/eval/calibration/c-vague.md",
        "line": 3
      },
      "fix": "Add e.g. \"Use immediately after writing or modifying code.\"",
      "source": "https://code.claude.com/docs/en/sub-agents"
    },
    {
      "severity": "suggestion",
      "rule": "body_structure.no_constraints_section",
      "message": "Body has no constraints / guardrails / anti-patterns section.",
      "produced_by": "static",
      "evidence": {
        "file": "/Users/fadymondy/Sites/agents-team/plugins/agents-team/lib/eval/calibration/c-vague.md",
        "line": 11
      },
      "fix": "Add a \"## Constraints\" section listing what the agent must NOT do.",
      "source": "https://code.claude.com/docs/en/sub-agents"
    }
  ],
  "produced_by": "static",
  "produced_at": "2026-04-29T12:02:03Z",
  "schema_version": "1.0.0"
}
